{
  "contract_version": "0.1.0",
  "backend": {
    "platform": "macos",
    "name": "corewlan",
    "backend_version": "0.1.0"
  },
  "interface": {
    "id": "en0",
    "driver": null
  },
  "capabilities": {
    "rssi_dbm": true,
    "strength_percent": false,
    "noise_dbm": true,
    "channel_width_mhz": true,
    "last_seen_resolution_ms": null
  },
  "scan": {
    "status": "completed",
    "started_at": "2026-01-01T12:00:00.000Z",
    "completed_at": "2026-01-01T12:00:01.000Z",
    "error": null
  },
  "observations": [
    {
      "ssid": "ExampleNet",
      "ssid_bytes_base64": "RXhhbXBsZU5ldA==",
      "bssid": "02:00:00:00:00:01",
      "rssi_dbm": -55,
      "strength_percent": null,
      "noise_dbm": -95,
      "frequency_mhz": 5180,
      "channel_width_mhz": 80,
      "connected": true,
      "freshness": "unknown",
      "last_seen_age_ms": null
    },
    {
      "ssid": "ExampleNet",
      "ssid_bytes_base64": "RXhhbXBsZU5ldA==",
      "bssid": "02:00:00:00:00:02",
      "rssi_dbm": -65,
      "strength_percent": null,
      "noise_dbm": -95,
      "frequency_mhz": 2437,
      "channel_width_mhz": 20,
      "connected": false,
      "freshness": "unknown",
      "last_seen_age_ms": null
    },
    {
      "ssid": "",
      "ssid_bytes_base64": "",
      "bssid": "02:00:00:00:00:03",
      "rssi_dbm": -75,
      "strength_percent": null,
      "noise_dbm": null,
      "frequency_mhz": 5975,
      "channel_width_mhz": null,
      "connected": false,
      "freshness": "unknown",
      "last_seen_age_ms": null
    }
  ]
}
